"NAME";"LOGO";"CHAPO FR";"CHAPO UK";"DESCRIPTIF FR";"DESCRIPTIF UK"
"MILAN";"BRAND-1.png";"Le mobilier audacieux qui ne passe pas inaperçu.";"Bold furniture that never goes unnoticed.";"MILAN dessine des pièces expressives où la couleur et la forme s'imposent comme une signature. Une collection vibrante pour les intérieurs qui assument leur caractère.";"MILAN designs expressive pieces where colour and shape become a signature. A vibrant collection for interiors that embrace their character."
"MAGIS";"BRAND-2.png";"Le design italien dans ce qu'il a de plus ludique.";"Italian design at its most playful.";"MAGIS conjugue innovation technique et esprit joyeux. Chaque produit est pensé pour durer et pour faire sourire, génération après génération.";"MAGIS combines technical innovation with a joyful spirit. Each product is built to last and to delight, generation after generation."
"OXYO";"BRAND-3.png";"Des lignes épurées pour un quotidien apaisé.";"Clean lines for a calmer everyday.";"OXYO mise sur la sobriété et les matières naturelles. Un design discret qui s'intègre sans effort à tous les styles d'intérieur.";"OXYO favours understatement and natural materials. A discreet design that blends effortlessly into any interior style."
"OFFUS";"BRAND-4.png";"L'élégance fonctionnelle au service du confort.";"Functional elegance built around comfort.";"OFFUS conçoit des assises ergonomiques sans compromis sur l'esthétique. Le confort devient une évidence, jour après jour.";"OFFUS creates ergonomic seating with no compromise on aesthetics. Comfort becomes second nature, day after day."
"PLINK";"BRAND-5.png";"Le mobilier modulable pour petits espaces.";"Modular furniture for small spaces.";"PLINK imagine des solutions malines et compactes. Empilables, pliables, transformables : ses créations s'adaptent à toutes les surfaces.";"PLINK imagines clever, compact solutions. Stackable, foldable, transformable: its pieces adapt to any footprint."
"PARRY";"BRAND-6.png";"L'artisanat du bois revisité.";"Woodcraft, reimagined.";"PARRY perpétue un savoir-faire artisanal avec des essences sélectionnées et des finitions soignées. Des pièces intemporelles faites pour traverser les années.";"PARRY carries on a craft tradition with selected woods and careful finishes. Timeless pieces made to last for years."
"TOKO";"BRAND-7.png";"L'inspiration scandinave, tout en douceur.";"Scandinavian inspiration, softly done.";"TOKO cultive la chaleur du bois clair et des teintes douces. Un design accueillant qui invite à la détente.";"TOKO embraces the warmth of light wood and soft tones. A welcoming design that invites you to unwind."
